Page,Question,Answer
page_92.png,What was the change in total hedging derivative assets/(liabilities) for the Group from 30 June 2023 to 30 June 2024?,"Total hedging derivative assets/(liabilities) for the Group changed from $3,088 million as assets and $(3,448) million as liabilities at 30 June 2023, to $2,466 million as assets and $(3,718) million as liabilities at 30 June 2024."
page_93.png,What is the total fair value of hedging derivatives assets for the Bank as of 30 June 2024?,"The total fair value of hedging derivatives assets for the Bank as of 30 June 2024 is $3,296 million.  "
page_93.png,How much notional amount of derivative contracts due within 1 year does the Bank hold as of 30 June 2024?,"The Bank holds $51,827 million in notional amount of derivative contracts due within 1 year as of 30 June 2024.  "
page_93.png,What is the total net investment hedges notional amount for the Bank as of 30 June 2024?,"The total net investment hedges notional amount for the Bank as of 30 June 2024 is $3,006 million.  "
page_93.png,What is the fair value adjustment for investment securities at fair value through other comprehensive income for the Group as of 30 June 2024?,"The fair value adjustment for investment securities at fair value through other comprehensive income for the Group as of 30 June 2024 is $(2,138) million.  "
page_93.png,What are the derivative liabilities for fair value hedges of interest rate and foreign exchange contracts for the Bank as of 30 June 2024?,"The derivative liabilities for fair value hedges of interest rate and foreign exchange contracts for the Bank as of 30 June 2024 are $(2,465) million.  "
page_93.png,What is the total notional amount of fair value hedges for the Bank as of 30 June 2024?,"The total notional amount of fair value hedges for the Bank as of 30 June 2024 is $65,837 million.  "
page_93.png,What is the fair value adjustment for debt issues hedged for interest rate risk for the Group as of 30 June 2024?,"The fair value adjustment for debt issues hedged for interest rate risk for the Group as of 30 June 2024 is $1,817 million.  "
page_93.png,What was the weighted average fixed interest rate of interest rate swaps as of 30 June 2024?,The weighted average fixed interest rate of interest rate swaps as of 30 June 2024 was 3.60%.  
page_93.png,What is the total notional amount of cash flow hedges for the Bank as of 30 June 2024?,"The total notional amount of cash flow hedges for the Bank as of 30 June 2024 is $483,504 million.  "
page_93.png,What is the carrying amount of loan capital hedged for interest rate and foreign exchange risk for the Bank as of 30 June 2024?,"The carrying amount of loan capital hedged for interest rate and foreign exchange risk for the Bank as of 30 June 2024 is $(4,768) million."
page_94.png,What was the cash flow hedge reserve for the Group as at 30 June 2024?,"The cash flow hedge reserve for the Group as at 30 June 2024 was $(2,146) million.  "
page_94.png,Which hedged item contributed the largest negative amount to the Group’s cash flow hedge reserve as at 30 June 2024?,"Loans and other receivables contributed the largest negative amount, $(3,365) million, to the Group’s cash flow hedge reserve as at 30 June 2024.  "
page_94.png,What is the total cash flow hedge reserve for the Bank as at 30 June 2024?,"The total cash flow hedge reserve for the Bank as at 30 June 2024 was $(1,746) million.  "
page_94.png,"For the year ended 30 June 2024, what was the amount recognized in the Group’s foreign currency translation reserve for net investment hedges?",The amount recognized in the Group’s foreign currency translation reserve for net investment hedges was $32 million.  
page_94.png,How did the Group’s debt issues impact the cash flow hedge reserve as at 30 June 2024?,Debt issues had a positive impact of $82 million on the Group’s cash flow hedge reserve as at 30 June 2024.  
page_94.png,What was the cash flow hedge reserve impact of investment securities at fair value through other comprehensive income for both Group and Bank as at 30 June 2024?,"For both the Group and the Bank, investment securities at fair value through other comprehensive income had a $(3) million impact on the cash flow hedge reserve as at 30 June 2024.  "
page_94.png,"What was the total cash flow hedge reserve for the Group as at 30 June 2023, and how does it compare to 2024?","The total cash flow hedge reserve for the Group as at 30 June 2023 was $(2,598) million, compared to $(2,146) million as at 30 June 2024, indicating a reduction in the negative reserve.  "
page_94.png,Which hedged item under the Bank’s cash flow hedges had the largest positive impact as at 30 June 2024?,"Deposits and other public borrowings had the largest positive impact of $1,145 million under the Bank’s cash flow hedges as at 30 June 2024.  "
page_94.png,How are highly probable forecast transactions reflected in the Group’s and Bank’s cash flow hedge reserves as at 30 June 2024?,Highly probable forecast transactions contributed $(44) million for the Group and $14 million for the Bank to the cash flow hedge reserve as at 30 June 2024.  
page_94.png,"According to the footnotes, what happens to the cumulative amount related to ceased hedge relationships?","The cumulative amount related to ceased hedge relationships, where the risk being hedged is interest rate and foreign exchange risk, is recognized in the income statement, with a gain or loss reported for the period."
page_95.png,What was the total hedge ineffectiveness recognised in the income statement for the Group's fair value hedges as of 30 June 2024?,The total hedge ineffectiveness recognised in the income statement for the Group's fair value hedges as of 30 June 2024 was $(25) million.  
page_95.png,How much change in the fair value of hedged items related to interest rate risk was reported by the Bank for the year ended 30 June 2024?,The Bank reported a change in the fair value of hedged items related to interest rate risk of $815 million for the year ended 30 June 2024.  
page_95.png,What is the change in the value of hedged items for the Group’s cash flow hedges and net investment hedges in interest rate risk as of 30 June 2024?,The change in the value of hedged items for the Group’s cash flow hedges and net investment hedges in interest rate risk as of 30 June 2024 was $(836) million.  
page_95.png,"According to the notes, how are derivatives initially measured for hedging purposes?",Derivatives are initially measured at fair value for hedging purposes.  
page_95.png,What amount of hedge ineffectiveness for foreign exchange fair value hedges was recognised in the Bank's income statement for the year ended 30 June 2024?,The Bank recognised $10 million of hedge ineffectiveness for foreign exchange fair value hedges in the income statement for the year ended 30 June 2024.  
page_95.png,What is the total change in the value of hedged items for the Bank’s cash flow hedges and net investment hedges as of 30 June 2024?,"The total change in the value of hedged items for the Bank’s cash flow hedges and net investment hedges as of 30 June 2024 was $(2,190) million.  "
page_95.png,How are changes in the value of fair value hedges recognised according to the Group’s accounting policies?,"Changes in the value of fair value hedges are recognised in the Income Statement, together with changes in the fair value of the hedged asset or liability attributable to the hedged risk.  "
page_95.png,What was the amount of unrealised gains deferred in the cash flow hedge reserve for the Group as of 30 June 2024?,The amount of unrealised gains deferred in the cash flow hedge reserve for the Group as of 30 June 2024 was $150 million.  
page_95.png,"For the Group, what was the hedge ineffectiveness recognised in the income statement for commodity price cash flow hedges for the year ended 30 June 2024?",The hedge ineffectiveness recognised in the income statement for commodity price cash flow hedges was $1 million.  
page_95.png,Under what circumstance is hedge ineffectiveness for fair value hedges recognised in other operating income?,Hedge ineffectiveness for fair value hedges is recognised in other operating income if it arises from mismatches in the accounting treatment between derivatives and underlying hedged items.
page_96.png,What is the total value of investment securities held at fair value through OCI for the Group as at 30 June 2024?,"The total value of investment securities held at fair value through OCI for the Group as at 30 June 2024 is $96,764 million.  "
page_96.png,"How much did the Bank hold in government bonds, notes, and securities at fair value through OCI as at 30 June 2024?","The Bank held $63,161 million in government bonds, notes, and securities at fair value through OCI as at 30 June 2024.  "
page_96.png,What is the total value of investment securities at amortised cost for the Group as at 30 June 2024?,"The total value of investment securities at amortised cost for the Group as at 30 June 2024 is $1,239 million.  "
page_96.png,What was the combined total investment securities for the Group as at 30 June 2024?,"The combined total investment securities for the Group as at 30 June 2024 was $98,013 million.  "
page_96.png,"According to the notes, what method is used to assess hedge effectiveness at inception of the hedge relationship?","At inception of the hedge relationship, prospective testing is performed on a statistical basis to assess the critical terms match between the hedging instrument and the hedged item.  "
page_96.png,What are the two criteria under which an embedded derivative is accounted for separately as a stand-alone derivative at fair value through income statement?,"An embedded derivative is accounted for separately if (1) the host contract is not carried at fair value through income statement, and (2) the economic characteristics and risks of the embedded derivative are not closely related to the host contract.  "
page_96.png,What was the amount of shares and equity investments held by the Group at fair value through OCI as at 30 June 2024?,"The Group held $2,438 million in shares and equity investments at fair value through OCI as at 30 June 2024.  "
page_96.png,How much of the Group’s investment securities at fair value through OCI are expected to mature within 1 to 5 years as at 30 June 2024?,"$34,419 million of the Group’s investment securities at fair value through OCI are expected to mature within 1 to 5 years as at 30 June 2024.  "
page_96.png,What is one reason for hedge ineffectiveness as stated in the notes?,"One reason for hedge ineffectiveness is differences in discounting between the hedged item and the hedging instrument, such as collateralised derivatives being discounted using Overnight Indexed Swaps (OIS) discount curves.  "
page_96.png,"As at 30 June 2024, what is the total value of the Bank’s investment securities at amortised cost?","As at 30 June 2024, the total value of the Bank’s investment securities at amortised cost is $2,032 million. "
page_97.png,What is the closing balance for right-of-use assets for the Group as of 30 June 2024?,"The closing balance for right-of-use assets for the Group as of 30 June 2024 is $2,171 million.  "
page_97.png,How are debt securities at fair value through other comprehensive income initially measured?,Debt securities at fair value through other comprehensive income are initially measured at fair value plus directly attributable transaction costs.  
page_97.png,"What was the total closing balance of property, plant and equipment for the Group as of 30 June 2024?","The total closing balance of property, plant and equipment for the Group as of 30 June 2024 was $3,676 million.  "
page_97.png,What accounting treatment is applied to impairment losses on debt securities at fair value through other comprehensive income?,"Impairment losses on debt securities at fair value through other comprehensive income are recognised in the Income Statement, with the expected credit loss approach applied.  "
page_97.png,What is the closing balance for equipment owned by the Bank as of 30 June 2024?,The closing balance for equipment owned by the Bank as of 30 June 2024 is $299 million.  
page_97.png,How are equity securities designated at fair value through other comprehensive income recognised in the financial statements?,Fair value gains and losses and foreign exchange gains and losses on these equity instruments are recognised in Other Comprehensive Income and are not reclassified to the Income Statement on derecognition.  
page_97.png,What is the value of total land and buildings for the Group as of 30 June 2024?,The value of total land and buildings for the Group as of 30 June 2024 is $485 million.  
page_97.png,How are investment securities at amortised cost measured after initial recognition?,Investment securities at amortised cost are measured using the effective interest method and are presented net of provisions for impairment.  
page_97.png,"What are the main components included under ""Other assets"" as described in the report?","""Other assets"" include assets not in lending, investing, trading, or other banking activities, such as right-of-use assets, property, plant and equipment, software, brand names, and goodwill.  "
page_97.png,"What is the total closing balance for right-of-use assets and property, plant and equipment held for own use for the Bank as of 30 June 2024?","The total closing balance for right-of-use assets and property, plant and equipment held for own use for the Bank as of 30 June 2024 is $3,417 million."
page_98.png,What was the carrying amount at the end of the year for right-of-use assets for the Group as of 30 June 2024?,"The carrying amount at the end of the year for right-of-use assets for the Group as of 30 June 2024 was $2,171 million.  "
page_98.png,What is the useful life of buildings according to the accounting policies described?,"The useful life of buildings is indefinite, and they are not depreciated.  "
page_98.png,How much did the Group add to its equipment assets during the year ended 30 June 2024?,The Group added $161 million to its equipment assets during the year ended 30 June 2024.  
page_98.png,"What was the total carrying amount of property, plant, and equipment for the Group at 30 June 2024?","The total carrying amount of property, plant, and equipment for the Group at 30 June 2024 was $3,676 million.  "
page_98.png,How are right-of-use assets initially measured according to the accounting policies?,"Right-of-use assets are initially measured at cost, which comprises the initial lease liability amount at present value, any lease payments before commencement, any initial direct costs, and estimated costs for disassembly or restoration.  "
page_98.png,What amount of land and buildings was reclassified to assets held for sale by the Group during the year ended 30 June 2024?,The Group reclassified $1 million of land and buildings to assets held for sale during the year ended 30 June 2024.  
page_98.png,What is the depreciation expense for equipment for the Group for the year ended 30 June 2024?,The depreciation expense for equipment for the Group for the year ended 30 June 2024 was $154 million.  
page_98.png,"For leasehold improvements, what was the carrying amount at the end of the year for the Bank as of 30 June 2024?",The carrying amount at the end of the year for leasehold improvements for the Bank as of 30 June 2024 was $481 million.  
page_98.png,What are the useful lives of equipment as specified in the accounting policies?,The useful lives of equipment are 3–25 years.  
page_98.png,What was the carrying amount at the end of the year for assets held as lessor for the Group as of 30 June 2024?,The carrying amount at the end of the year for assets held as lessor for the Group as of 30 June 2024 was $74 million.
page_99.png,What was the closing balance of goodwill for the Group as of 30 June 2024?,"The closing balance of goodwill for the Group as of 30 June 2024 was $5,285 million.  "
page_99.png,How much did the Group report as the total intangible assets as of 30 June 2024?,"The Group reported total intangible assets of $7,600 million as of 30 June 2024.  "
page_99.png,What was the opening balance for computer software costs for the Bank as of 30 June 2024?,"The opening balance for computer software costs for the Bank as of 30 June 2024 was $1,653 million.  "
page_99.png,"According to the report, what is the key assumption in the price-earnings (PE) multiple used to value banking cash-generating units?","The key assumption is the price-earnings (PE) multiple observed for similar businesses, which for the banking businesses were in the range of 14.3x-15.0x (30 June 2023: 11.1x-12.4x).  "
page_99.png,How much did the Group add in computer software costs during the year ended 30 June 2024?,The Group added $932 million in computer software costs during the year ended 30 June 2024.  
page_99.png,What was the amount of accumulated amortisation for the Group’s computer software costs as of 30 June 2024?,"The accumulated amortisation for the Group’s computer software costs as of 30 June 2024 was $2,843 million.  "
page_99.png,What is the closing balance for brand names for the Group and the Bank as of 30 June 2024?,The closing balance for brand names for both the Group and the Bank as of 30 June 2024 was $186 million.  
page_99.png,How are the recoverable amounts for goodwill and other intangible assets with indefinite lives determined?,"Recoverable amounts are determined based on fair value less cost to sell, primarily using an earnings multiple applicable to the type of business.  "
page_99.png,To which cash-generating units was goodwill allocated for the Group as of 30 June 2024?,"Goodwill was allocated to Retail Banking Services ($3,763 million), Business Banking ($1,241 million), New Zealand ($258 million), and Corporate Centre and Other ($23 million).  "
page_99.png,What was the closing balance of computer software costs for the Group as of 30 June 2024?,"The closing balance of computer software costs for the Group as of 30 June 2024 was $2,129 million."
page_100.png,What is the carrying amount of total other assets for the Group as at 30 June 2024?,"The carrying amount of total other assets for the Group as at 30 June 2024 is $10,232 million.  "
page_100.png,How are intangible assets with an indefinite useful life tested according to the accounting policies?,Intangible assets with an indefinite useful life are tested for impairment annually.  
page_100.png,What is the value of accrued interest receivable for the Bank as at 30 June 2024?,"Accrued interest receivable for the Bank as at 30 June 2024 is $3,817 million.  "
page_100.png,How are computer software costs amortized according to the report?,"Computer software costs are amortized over their estimated useful life on a straight-line basis, typically over three to five years.  "
page_100.png,What component of other assets includes $249 million of proceeds receivable as at 30 June 2024?,"As at 30 June 2024, other assets include $249 million of proceeds receivable in relation to divestments of businesses.  "
page_100.png,How are SaaS arrangement costs recognized under the accounting policies?,Costs incurred to configure or customise SaaS arrangements and ongoing fees to obtain access are generally recognised as operating expenses when the services are received.  
page_100.png,What is the defined benefit superannuation plan surplus for the Group as at 30 June 2024?,The defined benefit superannuation plan surplus for the Group as at 30 June 2024 is $436 million.  
page_100.png,What is the treatment of brand names acquired in a business combination according to the accounting policy?,Brand names acquired in a business combination are initially recognised at fair value and have an indefinite useful life if there is no foreseeable limit to the period over which they will generate cash flows.  
page_100.png,How are interest receivables recognized in the financial statements?,Interest receivables are recognised on an accruals basis.  
page_100.png,Where can further details on the defined benefit plan be found according to the notes?,Further details on the defined benefit plan are provided in Note 10.2.
page_101.png,What was the total amount of provisions for the Group as of 30 June 2024?,"The total amount of provisions for the Group as of 30 June 2024 was $2,908 million.  "
page_101.png,How much did the Bank report for employee entitlements provisions at 30 June 2024?,The Bank reported $991 million for employee entitlements provisions at 30 June 2024.  
page_101.png,"What is the maturity distribution of total provisions for the Group, distinguishing between less than and more than twelve months as of 30 June 2024?","As of 30 June 2024, the Group reported $2,423 million of provisions due in less than twelve months and $485 million due in more than twelve months.  "
page_101.png,How much did the Group recognize as provisions for customer remediation as of 30 June 2024?,The Group recognized $213 million as provisions for customer remediation as of 30 June 2024.  
page_101.png,What was the closing balance for divestments and restructuring provisions for the Group at 30 June 2024?,The closing balance for divestments and restructuring provisions for the Group at 30 June 2024 was $959 million.  
page_101.png,What amount of provisions did the Bank report for off balance sheet instruments at 30 June 2024?,The Bank reported $203 million of provisions for off balance sheet instruments at 30 June 2024.  
page_101.png,What was the total amount of provisions for the Bank as of 30 June 2023?,"The total amount of provisions for the Bank as of 30 June 2023 was $2,818 million.  "
page_101.png,"According to the accounting policies, under what condition is a provision recognized?","A provision is recognized when a present obligation from past events exists, settlement is probable, and the amount can be reliably estimated.  "
page_101.png,How much did the Group utilize from its customer remediation provisions during the year ended 30 June 2024?,The Group utilized $312 million from its customer remediation provisions during the year ended 30 June 2024.  
page_101.png,What is the closing balance for “Other” provisions for the Bank as of 30 June 2024?,The closing balance for “Other” provisions for the Bank as of 30 June 2024 was $194 million.
page_102.png,"What types of employee entitlements are provisions recognized for, as stated in the financial statements?","Provisions are recognized for employee entitlements such as long service leave, annual leave, and other employee benefits.  "
page_102.png,How does the Group determine provisions for customer remediation?,"Provisions for customer remediation require significant levels of estimation and judgment, considering various factors such as the number of impacted customers, the financial impact, and the average cost per case.  "
page_102.png,What was the balance of provisions held by the Group in relation to banking customer remediation programs as of 30 June 2024?,The balance of provisions held by the Group in relation to banking customer remediation programs was $173 million as of 30 June 2024.  
page_102.png,What are the main legal claims against the Group as at 30 June 2024 summarized under?,The main legal claims against the Group as at 30 June 2024 are summarized under Litigation in the financial statements.  
page_102.png,What was the total increase in provision for Aligned Advice remediation issues and program costs for the year ended 30 June 2024?,The Group recognized an increase in the provision for Aligned Advice remediation issues and program costs of $77 million during the year ended 30 June 2024.  
page_102.png,What is the purpose of provisions related to dividends as mentioned in the financial statements?,Provisions related to dividends are for dividends for prior periods that have not been settled at the balance sheet date.  
page_102.png,"As of 30 June 2024, what is the provision held by the Group for customer refunds on ongoing service fees, commissions, and other remediation matters?","As of 30 June 2024, the Group held a provision of $201 million for customer refunds on ongoing service fees, commissions, and other remediation matters.  "
page_102.png,"What was the outcome of the AUSTRAC civil penalty proceedings against CBA, and when was it approved?","The resolution of the AUSTRAC civil penalty proceedings was approved by the Federal Court on 20 June 2018, with CBA paying a penalty of $700 million and legal costs.  "
page_102.png,"What types of legal matters are the Group involved in, according to the Litigation section?","The Group is involved in legal proceedings related to shareholder class actions, superannuation class actions, and advice class actions.  "
page_102.png,What is stated regarding the ability to determine the ultimate impact of certain class actions on the Group?,"It is currently not possible to determine the ultimate impact of various class actions, if any, on the Group."
page_103.png,What was the outcome of the class action commenced against Count Financial in the Federal Court of Australia on 24 August 2020?,"A pre-trial mediation did not resolve the class action, and the matter proceeded to a 3-week initial trial in March 2024. Judgment remains reserved.  "
page_103.png,What is the status of the consumer credit insurance (CCI) class actions against CBA and CommInsure in the Federal Court of Australia?,"The proceedings are ongoing, with the claims relating to alleged non-disclosure and mis-selling of CCI products; a mediation was held, but the matter was not resolved.  "
