Page,Question,Answer
page_103.png,What decision did the New Zealand Court of Appeal make regarding ASB Bank’s appeal in the CCCFA class action?,"On 23 April 2024, the New Zealand Court of Appeal heard ASB’s appeal and reserved its decision, with the parties having until 16 August 2024 to apply to the Supreme Court of New Zealand for permission to appeal.  "
page_103.png,What penalties were imposed on CBA for contraventions of the Fair Work Act 2009 (Cth) related to employee underpayments as determined by the FWO and Federal Court judgments?,"The Federal Court imposed a penalty of $3.7 million on CBA and a penalty of $3.03 million on CommSec. CBA also agreed to pay $18,000 for CommSec and $100,000 for BWA in separate matters.  "
page_103.png,What ongoing regulatory reviews and investigations are mentioned that could impact the Group’s contingent liabilities?,"The Group is subject to ongoing reviews regarding compliance breaches, product and service reviews, interest and fee remediations, and other regulatory or statutory obligations, which may result in contingent liabilities.  "
page_103.png,How is the Group addressing financial crime compliance in response to AUSTRAC proceedings?,"The Group continues to invest in financial crime compliance, including its central AML/CTF Compliance team, regulatory and control operations, and the Financial Crime Domain, with a focus on coverage for financial crime risk.  "
page_103.png,What is the status of the remediation program for customers affected by employee underpayments at CommSec and BWA Group Services Pty Ltd?,"The Group’s ER remediation review for former and current employees is ongoing, with underpayments identified and penalties imposed by the courts.  "
page_103.png,What legal costs and penalties were associated with the Group’s proceedings involving the Fair Work Ombudsman and SafeWork NSW?,"CBA and CommSec were ordered to pay penalties totaling $6.73 million, including $3.7 million for CBA and $3.03 million for CommSec, plus legal costs as agreed with the regulators.  "
page_103.png,What are the risks identified by the Group in relation to its financial crime compliance and regulatory obligations?,"Risks include undetected failures or internal controls, ineffective remediation, ongoing and new investigations, potential legal actions, and regulatory fines or penalties.  "
page_103.png,What steps has the Group taken in relation to the independent expert’s review of its remodeled compliance program?,"The independent expert will conduct a final review once all actions from the remodeled action plan have been implemented, as required by the program."
page_104.png,"What fine did CBA pay to the ACMA in connection with breaches of the Spam Act 2003, and when was it paid?",CBA paid the ACMA a fine of $3.55 million on 2 June 2023 for breaches of the Spam Act 2003.  
page_104.png,What steps has CBA taken to comply with the enforceable undertaking issued by the ACMA?,"CBA appointed an independent consultant to review its compliance, provided the ACMA with a plan to implement the consultant’s recommendations, and committed to ongoing compliance reporting and training.  "
page_104.png,What is the total amount of ‘Bills payable and other liabilities’ for the Group as at 30 June 2024?,"The total amount of ‘Bills payable and other liabilities’ for the Group as at 30 June 2024 is $17,155 million.  "
page_104.png,How much did the Bank report as ‘Accrued interest payable’ as at 30 June 2024?,"The Bank reported $4,871 million as ‘Accrued interest payable’ as at 30 June 2024.  "
page_104.png,What accounting policy is followed for the measurement of bills payable and other liabilities?,"Bills payable and other liabilities are measured at the contractual amount payable, which approximates fair value as most are short-term in nature.  "
page_104.png,How are lease liabilities initially measured according to the accounting policies?,Lease liabilities are initially measured at the net present value of fixed lease payments as well as expected payments associated with residual value guarantees or purchase options of any lease termination.  
page_104.png,What is the amount of ‘Unearned income’ reported for the Group as at 30 June 2024?,The amount of ‘Unearned income’ reported for the Group as at 30 June 2024 is $763 million.  
page_104.png,What critical judgement is involved in measuring trail commission liabilities?,The measurement of trail commission liabilities depends on assumptions about the behavioural life and future outstanding balances of the underlying transactions.  
page_104.png,How does the Group treat exposures to divested businesses in its financial statements?,The Group recognises provisions where payments related to exposures to divested businesses are probable and reliably measurable.  
page_104.png,What are the components listed under ‘Bills payable and other liabilities’ for the Group as at 30 June 2024?,"The components are Bills payable, Accrued interest payable, Accrued fees, employee incentives and other items payable, Securities purchased not delivered, Unearned income, Lease liabilities, and Other."
page_105.png,"What is the primary purpose of the Group maintaining a strong capital position, as described in the overview?","The primary purpose is to satisfy regulatory capital requirements, provide financial security to depositors and creditors, and enable the Group to sustain its operations.  "
page_105.png,"Which regulatory authority applies the capital adequacy requirements to the Bank, as stated in the report?",APRA (Australian Prudential Regulation Authority) applies the capital adequacy requirements under the authority of the Banking Act 1959.  
page_105.png,What are the main components of regulatory capital as defined in the report?,"Regulatory capital is divided into Common Equity Tier 1 (CET1), Additional Tier 1 Capital, and Tier 2 Capital.  "
page_105.png,"How does the Group measure capital adequacy, according to the notes?","Capital adequacy is measured by means of risk-based capital ratios, specifically CET1, Additional Tier 1, Tier 2, and Total Capital Ratios as a percentage of total Risk Weighted Assets (RWA).  "
page_105.png,What is the total loan capital reported for the Group as of 30 June 2024?,"The total loan capital reported for the Group as of 30 June 2024 is AUD 32,696 million.  "
page_105.png,What is the amount of undated PERLS XV Tier 1 loan capital outstanding as of 30 June 2024?,"The amount of undated PERLS XV Tier 1 loan capital outstanding as of 30 June 2024 is AUD 1,750 million.  "
page_105.png,How often is the Group's capital position monitored and to whom is it reported?,"The Group's capital position is monitored on a continuous basis and reported monthly to the Executive Leadership Team, Asset and Liability Committee, and the Board.  "
page_105.png,What disclosure is made regarding capital adequacy requirements and APRA minimums?,"The Group’s actual ratios throughout 2022, 2023, and 2024 were in compliance with both APRA minimum capital adequacy requirements and the Board approved minimums, and the Board is notified immediately of any breach or potential breach.  "
page_105.png,"As of 30 June 2024 and 2023, were there any securities issued by the Group or the Bank contractually due for redemption in the next 12 months?","No, as of 30 June 2024 and 2023, there were no securities issued by the Group or the Bank contractually due for redemption in the next 12 months.  "
page_105.png,What is the fair value hedge adjustment applied to the total loan capital as of 30 June 2024 for the Group?,"The fair value hedge adjustment applied to the total loan capital as of 30 June 2024 for the Group is AUD (2,697) million."
page_106.png,What was the closing balance of ordinary shares on issue for the Group as of 30 June 2024?,"The closing balance of ordinary shares on issue for the Group as of 30 June 2024 was 33,695 million.  "
page_106.png,How many treasury shares did the Group hold at the closing balance on 30 June 2024?,The Group held 158 million treasury shares at the closing balance on 30 June 2024.  
page_106.png,What was the total number of shares on issue for the Group at the opening balance on 30 June 2023?,"The total number of shares on issue for the Group at the opening balance on 30 June 2023 was 33,743 million.  "
page_106.png,How many shares were bought back on-market by the Group during the year ended 30 June 2024?,The Group bought back 229 million shares on-market during the year ended 30 June 2024.  
page_106.png,What was the closing balance of shares on issue excluding treasury shares for the Group as of 30 June 2024?,"The closing balance of shares on issue excluding treasury shares for the Group as of 30 June 2024 was 1,673,580,356 shares.  "
page_106.png,What was the amount of the 2022/2023 interim dividend reinvestment plan issue?,The amount of the 2022/2023 interim dividend reinvestment plan issue was $97.37 million.  
page_106.png,Which currencies are mentioned for subordinated EMTN Tier 2 loan capital issuances excluding USD?,"The currencies mentioned are JPY (Japanese Yen), EUR (Euro), and HKD (Hong Kong Dollar).  "
page_106.png,Under which regulatory framework does the Group’s Tier 2 Capital qualify?,The Group’s Tier 2 Capital qualifies as Tier 2 Capital of the Bank under Basel III as implemented by APRA.  
page_106.png,What accounting policy is applied to loan capital by the Group?,"Loan capital is initially measured at fair value and subsequently measured at amortised cost using the effective interest method, with interest expense recognised in net interest income.  "
page_106.png,What is the par value of ordinary shares issued by the Company?,Ordinary shares have no par value and the Company does not have a limited amount of share capital.
page_107.png,What was the opening balance of retained profits for the Group as of 30 June 2024?,"The opening balance of retained profits for the Group as of 30 June 2024 was $40,010 million.  "
page_107.png,How much was the net profit attributable to equity holders of the Bank for the Group during the year ended 30 June 2024?,"The net profit attributable to equity holders of the Bank for the Group was $9,394 million.  "
page_107.png,What was the closing balance of retained profits for the Bank as of 30 June 2024?,"The closing balance of retained profits for the Bank as of 30 June 2024 was $33,886 million.  "
page_107.png,How much was transferred from the asset revaluation reserve to retained profits for the Group in the year ended 30 June 2024?,$1 million was transferred from the asset revaluation reserve to retained profits for the Group.  
page_107.png,What was the closing balance of the cash flow hedge reserve for the Group as of 30 June 2024?,"The closing balance of the cash flow hedge reserve for the Group as of 30 June 2024 was $(1,510) million.  "
page_107.png,What is the total shareholders’ equity attributable to equity holders of the Bank for the Group as of 30 June 2024?,"The total shareholders’ equity attributable to equity holders of the Bank for the Group as of 30 June 2024 was $71,228 million.  "
page_107.png,What was the closing balance of the investment securities revaluation reserve for the Bank as of 30 June 2024?,The closing balance of the investment securities revaluation reserve for the Bank as of 30 June 2024 was $(717) million.  
page_107.png,How much was recognized in other comprehensive income for cash flow hedging instruments for the Group in the year ended 30 June 2024?,"$1,408 million was recognized in other comprehensive income for cash flow hedging instruments for the Group.  "
page_107.png,What was the closing balance of the employee compensation reserve for the Group as of 30 June 2024?,The closing balance of the employee compensation reserve for the Group as of 30 June 2024 was $99 million.  
page_107.png,What is the total shareholders’ equity for the Group as of 30 June 2024?,"The total shareholders’ equity for the Group as of 30 June 2024 was $73,088 million. "
page_108.png,What is the total dividend paid by the Group for the year ended 30 June 2024?,"The total dividend paid by the Group for the year ended 30 June 2024 is $3,604 million.  "
page_108.png,What is the closing balance of the provision for dividends for the Group as at 30 June 2024?,The closing balance of the provision for dividends for the Group as at 30 June 2024 is $191 million.  
page_108.png,How much did the Bank pay as a final fully franked dividend per share for the year ended 30 June 2024?,The Bank determined a final fully franked dividend of 250 cents per share for the year ended 30 June 2024.  
page_108.png,What is the total franking credits available to the Group as at 30 June 2024?,"The total franking credits available to the Group as at 30 June 2024 is estimated to be $1,861 million.  "
page_108.png,How much were the New Zealand imputation credits available to CBA as at 30 June 2024?,The New Zealand imputation credits available to CBA as at 30 June 2024 were NZ$894 million.  
page_108.png,What is the total dividend paid and not recognised as a liability for the Group for the year ended 30 June 2024?,"The total dividend paid and not recognised as a liability for the Group for the year ended 30 June 2024 is $4,184 million.  "
page_108.png,What accounting policy is applied to ordinary shares in the Group’s financial statements?,"Ordinary shares are recognised at the amount paid per share, net of directly attributable issue costs, and shares acquired by the Group are deducted from total shareholders' equity.  "
page_108.png,What is the purpose of the asset revaluation reserve according to the accounting policies?,"The asset revaluation reserve is used to record revaluation adjustments on the Group’s property assets, with any balance transferred to retained profits upon disposal or sale.  "
page_108.png,What does the employee compensation reserve represent?,The employee compensation reserve is used to recognise the fair value of shares and other equity instruments issued to employees under employee share plans and bonus schemes.  
page_108.png,What factors does the Board consider when determining the Bank’s dividend policy?,"The Board considers factors such as paying cash dividends at sustainable levels, targeting a full-year payout ratio of 70-80%, and maximising the use of the franking account by paying fully franked dividends."
page_109.png,What was the dividend per share declared for the half year ended 30 June 2024?,The dividend per share declared for the half year ended 30 June 2024 was 250 cents.  
page_109.png,What was the half year payout ratio for the period ended 30 June 2024?,The half year payout ratio for the period ended 30 June 2024 was 90.3%.  
page_109.png,What is the stated policy regarding the determination of dividends?,The Board determines dividends by considering the Group’s relative capital strength and existing dividend payout ratio guidelines.  
page_109.png,What was the Dividend Reinvestment Plan (DRP) participation rate for the half year ended 31 December 2023?,The DRP participation rate for the half year ended 31 December 2023 was 13.4%.  
page_109.png,"According to the report, what are the main categories of risks to which the Group is exposed?","The Group is exposed to financial, non-financial, and strategic risks.  "
page_109.png,Which committees are involved in the oversight of risk management according to the risk management framework?,"The Risk & Compliance Committee, Audit Committee, Financial Risk Committee (FRC), Non-Financial Risk Committee (NFRC), and People & Remuneration Committee are involved.  "
page_109.png,What was the full year payout ratio for the year ended 30 June 2024?,The full year payout ratio for the year ended 30 June 2024 was 82.9%.  
page_109.png,How are dividends recognized in the financial statements?,Dividends are recognized with a corresponding reduction of retained earnings on the dividend payment date.  
page_109.png,What is the Group’s approach to managing risk as described in the overview?,"The Group manages risk through its Risk Management Framework (RMF), which adapts to changes in the business environment and incorporates governance and oversight by executive and Board committees.  "
page_109.png,"For the dividend paid on 31 December 2022, what was the DRP price and participation rate?",The DRP price was $97.37 and the participation rate was 16.8%.
page_110.png,What are the three key documents incorporated in the Group's risk management framework?,"The three key documents are the Group’s Business Plan, the Group Risk Appetite Statement (RAS), and the Group Risk Management Approach (RMA).  "
page_110.png,What is the role of the Risk and Compliance Committee regarding risk governance?,The Risk and Compliance Committee oversees the risk management framework and helps formulate the Group’s risk appetite for consideration by the Board.  
page_110.png,How does the Group ensure regular management of risk information?,"Regular management of risk information is undertaken through a structured hierarchy of personal delegations, management committees, and forums across the Group.  "
page_110.png,Which processes and tools does the Risk Management Framework (RMF) use to support risk management?,"The RMF uses risk processes to identify, assess, escalate, monitor, and manage risks; management information systems to measure and aggregate risks; and data, risk models, and tools for significant calculations.  "
page_110.png,How does the Group promote risk accountability and skills among employees?,"The Group promotes risk accountability and skills through communication of the RAS and RMA, performance and remuneration frameworks, risk management learning modules, risk management capability frameworks, and ongoing induction and ongoing learning support.  "
page_110.png,What is the purpose of the Group Risk Appetite Statement (RAS)?,The RAS establishes the type and degree of risk the Board is prepared to accept and the level of risk the Group must operate within to achieve its strategy.  
page_110.png,What is the function of the Three Lines of Accountability (3LoA) model?,"The 3LoA model organises accountabilities to ensure risk is well managed by separating roles for managing and overseeing risks, defining risk frameworks, and providing independent assurance.  "
page_110.png,What is expected of employees regarding risk culture and conduct risk?,"Employees are expected to understand different perspectives, apply appropriate judgement to mitigate risks, and deliver better outcomes for customers and shareholders, with behaviours aligned to the Group’s values and leadership principles.  "
page_110.png,How are risk policies and procedures used within the Group?,Risk policies and procedures outline the principles and practices for identifying and assessing material risks and translating the risk appetite into daily business operations.  
page_110.png,What actions does the Board take annually regarding risk culture?,"Annually, the Board forms a view of the Group’s risk culture, identifies desirable changes, and initiates and monitors actions to improve and sustain risk culture. "
page_111.png,What are the primary types of credit risk to which the Group is exposed?,"The primary types of credit risk to which the Group is exposed are residential mortgage lending, unsecured retail lending, commercial lending, and large corporate (institutional) lending and markets exposures.  "
page_111.png,Which committees are responsible for overseeing credit risk according to the financial report?,"The committees responsible for overseeing credit risk are the Group and BU Credit Risk Standard Committee, Financial Risk Committee, and BU/SU Financial Risk Committees, with additional oversight by the Loan Losses Provisioning Committee.  "
page_111.png,What strategies are used to mitigate credit risk within the Group?,"Strategies to mitigate credit risk include defined credit risk indicators, transacting with creditworthy counterparties, appropriate pricing for risk, credit concentration frameworks, regular credit quality monitoring, working with troubled counterparties, holding adequate provisions, and stress testing at both counterparty and portfolio levels.  "
page_111.png,How does the Group address market risk related to non-proprietary trading activities?,The Group does not engage in proprietary trading unrelated to the core principal trading and aligns with approved business strategy to address market risk.  
page_111.png,What key risk metrics are monitored to manage market risk?,"Key risk metrics monitored include Value at Risk (VaR), market sensitivities, Net Interest Earnings at Risk, stress testing, and daily monitoring and attribution of exposures.  "
page_111.png,Which policy documents govern the management of market risk?,"Market risk is governed by the Group Market Risk Policy, Group Traded Market Risk Standards, and oversight committees such as the Financial Risk Committee and Asset and Liability Committee (ALCO).  "
page_111.png,What are the main controls in place to manage liquidity risk?,"Main controls include defined liquidity risk appetite indicators, an annual funding strategy, maintaining diverse and stable funding sources, short-term liquidity buffers, limiting offshore wholesale funding, asset/liability maturity management, and stress testing.  "
page_111.png,Which committees oversee the Group's management of liquidity risk?,Liquidity risk is overseen by the ALCO (Asset and Liability Committee) and the Stress Testing Steering Committee.  
page_111.png,How does the Group ensure readiness for liquidity shortfalls in a crisis situation?,The Group maintains a Contingent Funding Plan to provide strategies for addressing liquidity shortfalls in a crisis situation.  
page_111.png,What is the stated objective of the Group’s conservative market risk policy?,"The objective is to maintain granular concentration limits at a position level, including currency, tenor, and product type, to manage risk conservatively."
page_112.png,What are the primary sources of operational risk identified by the Group?,"The primary sources of operational risk identified by the Group include accounting and taxation risk, artificial intelligence risk, business disruption risk, cybersecurity risk, data management risk, fraud and scams risk (external and internal), legal risk, model risk, people risk, technology risk, third party risks, and transaction processing risk.  "
page_112.png,Which policies are listed under Governing Policies for managing operational risk?,"Governing Policies for managing operational risk include the Operational Risk Management Policy, Group Operational Risk Management Framework (QRMF), Group Information Security (IS) Policy, Group Data Management Policy, Group Fraud Management Policy, Group Whistleblower Policy, Group Model Policy, Group Policy on Business Continuity Management, Group Protective Security Policy, Group IT Service Support and Management Policy, Group Supplier Lifecycle Policy, and Group Artificial Intelligence Policy.  "
page_112.png,What key management committees are responsible for overseeing operational risk?,"Key management committees responsible for overseeing operational risk are the Non-Financial Risk Committee, BUSU Non-Financial Risk Committees, Model Risk Governance Committee (MRGC), Supplier Governance Council, Technology Controls Committee, and BUSU Executive Portfolio Group (EPG).  "
page_112.png,"What mechanisms are in place to detect, prevent, and mitigate operational risks?","Mechanisms in place to detect, prevent, and mitigate operational risks include defined operational risk indicators in the Group RAS, manual and automatic controls, regular Risk and Control Self-Assessment (RCSA), routine Controls Assessment Program (CAP) tests, incident management process, issue management process, the Risk and Change process, establishment of key risk indicators, assurance by Line 2 Risk teams, and Risk Steward Guidance.  "
page_112.png,How does the Group ensure that operational risks are appropriately identified and managed?,"The Group ensures operational risks are appropriately identified and managed through assurance undertaken by Line 2 Risk teams, regular monitoring of risk exposures, and ongoing Risk Steward Guidance on key controls and routine monitoring of RAS and risk reporting.  "
page_112.png,What is compliance risk as defined in the financial report?,"Compliance risk is defined as the risk of legal or regulatory sanctions, material financial loss, or loss of reputation that the Group may incur as a result of a failure to comply with its obligations.  "
page_112.png,What are the key elements of compliance risk exposure highlighted in the report?,"Key elements of compliance risk exposure include laws, regulations, rules, licence conditions, statements of regulatory policy, privacy laws and regulations on collection and protection of personal information, financial crime regulations (e.g., Anti-Money Laundering, Counter Terrorism Financing, Anti-Bribery and Corruption), and poor conduct (e.g., product design/distribution, market conduct, anti-competitive practices).  "
page_112.png,Which policies govern the management of compliance risk?,"Policies governing the management of compliance risk include the Group Compliance Management Framework, Group and Business Unit Compliance Policies and Standards, Joint AML/CTF Group Program, Anti-Bribery & Corruption Policy, Anti-Tax Evasion Facilitation Policy, Group Economic Trade Sanctions Policy, Product Development and Distribution Policy, Anti-Competitive Practices Policy, Group Consumer Protection Policy, Group Customer Complaint Management Policy, Group Customer Remediation Policy, and Group Securities Trading Policy.  "
